title,type,description,speakers,date,time_start,time_end,length_in_hours,room,event_id,event_url
A roundup of international CAR,Panel,,TBA,2017-03-04,10:15,11:15,1.0,Conference Center B,2702/3116,https://ire.org/events-and-training/event/2702/3116/
Public finance and the EMMA website,Hands-on,"For reporters covering state or local government, the Electronic Municipal Market Access (EMMA®) website provides free access to detailed information about the financial health of states, cities and counties, as well as many hospitals, universities, stadiums and other ventures financed by public debt. Staff from the Municipal Securities Rulemaking Board will demonstrate how to find data and information on EMMA, from public finance credit ratings to comprehensive annual financial reports. This interactive session will also highlight several EMMA tools and resources that can assist reporters with monitoring state and local finances and identify potential stories.","Leah Szarek,",2017-03-04,10:15,11:15,1.0,City Terrace 4,2702/2953,https://ire.org/events-and-training/event/2702/2953/
Stats: Linear regression,Hands-on,,John Perry,2017-03-04,10:15,11:15,1.0,City Terrace 9,2702/2960,https://ire.org/events-and-training/event/2702/2960/
Social media scraping,Hands-on,"From President Donald Trump’s Twitter account to fake news — social media platforms have become a major source for news.

This hands-on session will give journalists the ability to harvest information from the social web in structured and automated ways. Participants will learn how to collect information from Facebook pages and Twitter accounts via scraping and APIs and turn them into spreadsheets.

To get the most out of this session: Attendees should have a basic grasp of programming concepts but do not need to be proficient in coding. Attendees should have their own Twitter and Facebook accounts and create app IDs for API access in advance of the session.","Cathy Deng, Lam Thuy Vo",2017-03-04,10:15,11:15,1.0,City Terrace 7,2702/2958,https://ire.org/events-and-training/event/2702/2958/
Investigating bias and influence in criminal justice: Police and prosecutors,Panel,,TBA,2017-03-04,11:30,12:30,1.0,River Terrace 3,2702/3021,https://ire.org/events-and-training/event/2702/3021/
Command line tools for reporters (PC),Hands-on,,TBA,2017-03-04,11:30,12:30,1.0,City Terrace 11,2702/3121,https://ire.org/events-and-training/event/2702/3121/
Personalized interactive journeys,Demo,,"Scott Blumenthal, Sandeep Junnarkar",2017-03-04,11:30,12:30,1.0,River Terrace 2,2702/3117,https://ire.org/events-and-training/event/2702/3117/
Visualization and analysis in Python (repeat session),Hands-on,,Chase Davis,2017-03-04,11:30,12:30,1.0,City Terrace 8,2702/3098,https://ire.org/events-and-training/event/2702/3098/
Going long on middleform,Panel,"**Moderated by Tom Cardoso, The Globe and Mail","Darla Cameron, Sarah Frostenson, Maureen Linke, Stuart Thompson, Tom Cardoso",2017-03-04,11:30,12:30,1.0,Conference Center A,2702/2920,https://ire.org/events-and-training/event/2702/2920/
Security tools for journalists (repeat session),Hands-on,,TBA,2017-03-04,11:30,12:30,1.0,City Terrace 4,2702/3069,https://ire.org/events-and-training/event/2702/3069/
Design track: Using a charting tool (Sponsored by Society for News Design),Hands-on,,TBA,2017-03-04,11:30,12:30,1.0,City Terrace 7,2702/3055,https://ire.org/events-and-training/event/2702/3055/
Stats: Logistic regression,Hands-on,,Jennifer LaFleur,2017-03-04,11:30,12:30,1.0,City Terrace 9,2702/2963,https://ire.org/events-and-training/event/2702/2963/
Conversations 11 (Sponsored by SRCCON - Knight Mozilla OpenNews),Special Event,,TBA,2017-03-04,11:30,12:30,1.0,City Terrace 12,2702/2986,https://ire.org/events-and-training/event/2702/2986/
TBD,Hands-on,,TBA,2017-03-04,11:30,12:30,1.0,City Terrace 11,2702/2965,https://ire.org/events-and-training/event/2702/2965/
Carwash: Data cleaning in Excel,Hands-on,,TBA,2017-03-04,11:30,12:30,1.0,City Terrace 10,2702/2964,https://ire.org/events-and-training/event/2702/2964/
Lunch on your own (Saturday),Outside Event,,TBA,2017-03-04,12:30,14:15,1.75,See printed schedule for room information,2702/2998,https://ire.org/events-and-training/event/2702/2998/
Conversations 12 (Sponsored by SRCCON - Knight Mozilla OpenNews),Special Event,,TBA,2017-03-04,12:45,13:45,1.0,City Terrace 12,2702/2987,https://ire.org/events-and-training/event/2702/2987/
Using R as a GIS for spatial analysis and visualization (advanced),Hands-on,"In this session, we'll be using R for spatial analysis and creating publication-worthy map graphics. Learn how to go beyond the dots to dig deeper and tell better stories with location data in bulk.",Andrew Tran,2017-03-04,14:15,15:15,1.0,City Terrace 5,2702/3083,https://ire.org/events-and-training/event/2702/3083/
What product can do for journalism,Panel,"Media companies, both startups, and legacy organizations are investing in news products, such as mobile apps, email newsletters, SMS bots, etc. The product approach, which demands design, data, technology, journalism, and management skills, is critical to the future of media and can lead to new revenue streams and rewarding new career paths.","Marie Gilot, Celeste LeCompte, Stacy-Marie Ishmael",2017-03-04,14:15,15:15,1.0,Conference Center A,2702/3035,https://ire.org/events-and-training/event/2702/3035/
Working with academics,Panel,,TBA,2017-03-04,14:15,15:15,1.0,River Terrace 1,2702/3048,https://ire.org/events-and-training/event/2702/3048/
Getting started with Access without using SQL,Hands-on,,Mc Nelly Torres,2017-03-04,14:15,15:15,1.0,City Terrace 9,2702/3084,https://ire.org/events-and-training/event/2702/3084/
Visualizing and understanding uncertainty (Sponsored by Society for News Design) **pre-registered attendees only,Hands-on,"Statistics is the science of uncertainty. It’s an invaluable tool for journalists trying to help readers and viewers make good choices with imperfect data. But though our models come with uncertainty, we are sometimes bad at helping readers understand the uncertainty that’s built into our work. Science is not far ahead of us -- look at the uncertainty cone in a hurricane, which lay readers often mistake for hurricane size. Look at how readers misinterpreted election predictions, even when they came with confidence intervals or likelihood measurements. How can we explain uncertainty better so that readers understand it? This is designed to be a hands-on collaborative workshop in which science communicators and visual journalists discuss the state of the art in visualizing uncertainty, then come up with some new directions via sketching and prototyping.

Preregistration is required and seating is limited. Computers will not be provided for this workshop so please bring your laptop.

NOTE: Registration is required for this session. Click here to sign up.",TBA,2017-03-04,14:15,17:45,3.5,City Terrace 4,2702/3054,https://ire.org/events-and-training/event/2702/3054/
Inaugural hack swap,Special Event,,"Jeremy Bowers, Andrew Chavez, John McClure",2017-03-04,14:15,15:15,1.0,City Terrace 12,2702/2988,https://ire.org/events-and-training/event/2702/2988/
30/60: Thirty of the best free data storytelling tools in sixty mins,Demo,"Settle in and buckle up! News innovators-in-residence Mike Reilley a trainer with the SPJ/Google News Lab program and Victor Hernandez from Banjo crank up the gravity-defying mind-bending roller coaster of new digital tools -- 30 of the latest and greatest (and free) for your data reporting toolkits. Featuring hands-on training focused on the newest available data visualization methods, mapping tools, mobile newsgathering apps and more -- this adventure promises all of the excitement of your favorite thrill ride, sans the motion sickness.","Victor Hernandez, Mike Reilley",2017-03-04,14:15,15:15,1.0,River Terrace 2,2702/2922,https://ire.org/events-and-training/event/2702/2922/
Building your first Leaflet.js map,Hands-on,"Maps! Who doesn't love wonderful, colorful maps? In this course we will be building a map with Leaflet.js., a very popular Javascript mapping library. The map will display both markers and shapes. The shapes will be used to create a basic choropleth map.",Chris Essig,2017-03-04,14:15,15:15,1.0,City Terrace 7,2702/2966,https://ire.org/events-and-training/event/2702/2966/
Investigating bias and influence in criminal justice: Judges and beyond,Panel,"**Moderated by Cheryl Phillips, Stanford University","Cheryl Phillips, Michael Braga, Robert Gebeloff, Barnaby Skinner",2017-03-04,14:15,15:15,1.0,River Terrace 3,2702/2926,https://ire.org/events-and-training/event/2702/2926/
Data can only dance with its music: Understanding the ecology of public data,Panel,,"Carli Brosseau, Tom Johnson, Andrew Lehren",2017-03-04,14:15,15:15,1.0,Conference Center B,2702/2921,https://ire.org/events-and-training/event/2702/2921/
Advanced Django for data analysis,Hands-on,,Adam Playford,2017-03-04,14:15,15:15,1.0,City Terrace 8,2702/3122,https://ire.org/events-and-training/event/2702/3122/
Collaborating with the competition,Panel,,TBA,2017-03-04,15:30,16:30,1.0,River Terrace 1,2702/3118,https://ire.org/events-and-training/event/2702/3118/
"Earth, wind and fire: Covering disasters from a data perspective",Panel,,TBA,2017-03-04,15:30,16:30,1.0,River Terrace 3,2702/2923,https://ire.org/events-and-training/event/2702/2923/
Tools to convert lots of PDFs at once,Demo,,"Todd Wallack, Miguel Barbosa",2017-03-04,15:30,16:30,1.0,River Terrace 2,2702/2924,https://ire.org/events-and-training/event/2702/2924/
Localize that investigation: Using AP data to do your own stories,Special Event,,"Troy Thibodeaux, Meghan Hoyer",2017-03-04,15:30,16:30,1.0,City Terrace 12,2702/2989,https://ire.org/events-and-training/event/2702/2989/
Google Fusion Tables (beginner),Hands-on,,Daniel Lathrop,2017-03-04,15:30,16:30,1.0,City Terrace 8,2702/2973,https://ire.org/events-and-training/event/2702/2973/
Self-promotion for the data reporter,Panel,,TBA,2017-03-04,15:30,16:30,1.0,Conference Center A,2702/3037,https://ire.org/events-and-training/event/2702/3037/
"Javascript charts and maps, straight from R (intermediate)",Hands-on,"In this session, we'll be using htmlwidgets to create simple JavaScript charts and maps, straight from your R data analysis pipeline and with no need to write JavaScript",Peter Aldhous,2017-03-04,15:30,16:30,1.0,City Terrace 5,2702/2968,https://ire.org/events-and-training/event/2702/2968/
Command line for reporters (Unix),Hands-on,,AJ Vicens,2017-03-04,15:30,16:30,1.0,City Terrace 7,2702/3065,https://ire.org/events-and-training/event/2702/3065/
Counting & summing with Access without using SQL,Hands-on,,Tisha Thompson,2017-03-04,15:30,16:30,1.0,City Terrace 9,2702/3085,https://ire.org/events-and-training/event/2702/3085/
"Internet Archive: Resources, tools, and tricks",Demo,,Nancy Watzman,2017-03-04,16:45,17:45,1.0,River Terrace 2,2702/2927,https://ire.org/events-and-training/event/2702/2927/
Regular expressions,Hands-on,,Justin Myers,2017-03-04,16:45,17:45,1.0,City Terrace 8,2702/3086,https://ire.org/events-and-training/event/2702/3086/
Animated videos,Hands-on,,Kavya Sukumar,2017-03-04,16:45,17:45,1.0,City Terrace 7,2702/2969,https://ire.org/events-and-training/event/2702/2969/
Joining in Access without using SQL,Hands-on,,Helena Bengtsson,2017-03-04,16:45,17:45,1.0,City Terrace 9,2702/3088,https://ire.org/events-and-training/event/2702/3088/
Separating fact from fiction: Information verification,Panel,,Steve Myers,2017-03-04,16:45,17:45,1.0,Conference Center A,2702/2925,https://ire.org/events-and-training/event/2702/2925/
Advanced analysis in SQL (repeat session),Hands-on,,Chris Schnaars,2017-03-04,16:45,17:45,1.0,City Terrace 5,2702/3087,https://ire.org/events-and-training/event/2702/3087/
Command line graphics,Demo,,Jon Keegan,2017-03-05,09:00,10:00,1.0,River Terrace 2,2702/3119,https://ire.org/events-and-training/event/2702/3119/
Finding connections in campaign finance data with graph databases,Hands-on,,TBA,2017-03-05,09:00,10:00,1.0,City Terrace 7,2702/3066,https://ire.org/events-and-training/event/2702/3066/
Conference sales (Sunday),Special Event,,TBA,2017-03-05,09:00,10:30,1.5,3rd floor - Skybridge,2702/3007,https://ire.org/events-and-training/event/2702/3007/
Year in CAR (repeat),Panel,,"Lauren Grandestaff, Kaitlin Washburn",2017-03-05,09:00,10:00,1.0,River Terrace 1,2702/2928,https://ire.org/events-and-training/event/2702/2928/
Just enough Django: Distributed data entry in the newsroom (beginner/intermediate) *pre-registered attendees only,Hands-on,"Ben Welsh presents a step-by-step guide to creating a simple web application that empowers you to enlist reporters in data entry and refinement. The 3-hour, hands-on tutorial will teach you how to take advantage of the Django Web framework's powerful administration panel, without bothering with all the other web developer crap. You will learn how to design database tables, load in data and quickly create a system for others to improve it.

Preregistration is required and seating is limited. Laptops will be provided for the training.

Workshop prerequisites: If you have a good attitude and know how to take a few code crashes in stride, you are qualified for this class.

NOTE: Registration is required for this session. Click here to sign up.","Dana Amihere, Ben Welsh",2017-03-05,09:00,12:30,3.5,City Terrace 6,2702/2884,https://ire.org/events-and-training/event/2702/2884/
OpenElections hackathon,Special Event,,"Derek Willis, Serdar Tumgoren",2017-03-05,09:00,12:30,3.5,City Terrace 12,2702/2990,https://ire.org/events-and-training/event/2702/2990/
Getting data into Excel,Hands-on,,Emmanuel Martinez,2017-03-05,09:00,10:00,1.0,City Terrace 5,2702/3072,https://ire.org/events-and-training/event/2702/3072/
Twitter tricks and analytics,Hands-on,,Doug Haddix,2017-03-05,09:00,10:00,1.0,City Terrace 4,2702/3070,https://ire.org/events-and-training/event/2702/3070/
Stats: Linear regression (repeat session),Hands-on,,Jeff Kelly Lowenstein,2017-03-05,09:00,10:00,1.0,City Terrace 8,2702/3094,https://ire.org/events-and-training/event/2702/3094/
ArcGIS Online and the power of Story Maps,Hands-on,,TBA,2017-03-05,10:15,11:15,1.0,City Terrace 5,2702/3092,https://ire.org/events-and-training/event/2702/3092/
Stats: Logistic regression (repeat session),Hands-on,,Jennifer LaFleur,2017-03-05,10:15,11:15,1.0,City Terrace 8,2702/3095,https://ire.org/events-and-training/event/2702/3095/
Let's get creepy: Backgrounding tips from a journalist and librarian,Panel,,"Sarah Hutchins, Lauren Grandestaff",2017-03-05,10:15,11:15,1.0,River Terrace 1,2702/2929,https://ire.org/events-and-training/event/2702/2929/
Career roundtable,Panel,,TBA,2017-03-05,10:15,11:15,1.0,River Terrace 3,2702/3044,https://ire.org/events-and-training/event/2702/3044/
Data analysis in Javascript and Node.js,Hands-on,,Daniel Lathrop,2017-03-05,10:15,11:15,1.0,City Terrace 7,2702/3067,https://ire.org/events-and-training/event/2702/3067/
Programming best practices,Demo,,Jeff Larson,2017-03-05,10:15,11:15,1.0,River Terrace 2,2702/3120,https://ire.org/events-and-training/event/2702/3120/
Getting data into Access,Hands-on,,Tracy Greer,2017-03-05,11:30,12:30,1.0,City Terrace 5,2702/3071,https://ire.org/events-and-training/event/2702/3071/
Advanced social media sleuthing (repeat session),Hands-on,,Sarah Hutchins,2017-03-05,11:30,12:30,1.0,City Terrace 4,2702/3093,https://ire.org/events-and-training/event/2702/3093/
Social media sleuthing,Panel,,Doug Haddix,2017-03-05,11:30,12:30,1.0,River Terrace 1,2702/2930,https://ire.org/events-and-training/event/2702/2930/
Google Fusion Tables (advanced),Hands-on,,Tommy Kaas,2017-03-05,11:30,12:30,1.0,City Terrace 8,2702/2970,https://ire.org/events-and-training/event/2702/2970/
