title,type,description,speakers,date,time_start,time_end,length_in_hours,room,event_id,event_url
A hitchhiker's guide To APIs,Hands-on,,David Eads,2017-03-02,16:45,17:45,1.0,City Terrace 8,2702/3064,https://ire.org/events-and-training/event/2702/3064/
Mining data from the social web,Demo,,TBA,2017-03-02,16:45,17:45,1.0,River Terrace 2,2702/3112,https://ire.org/events-and-training/event/2702/3112/
Data for radio: Turning data into characters in your story,Panel,,TBA,2017-03-02,16:45,17:45,1.0,River Terrace 3,2702/3040,https://ire.org/events-and-training/event/2702/3040/
Open 3d sandbox,Special Event,,"Joe Fox, Armand Emamdjomeh",2017-03-02,16:45,17:45,1.0,City Terrace 12,2702/3050,https://ire.org/events-and-training/event/2702/3050/
Design track: Intermediate D3 (Sponsored by Society for News Design),Hands-on,,TBA,2017-03-02,16:45,17:45,1.0,City Terrace 7,2702/3053,https://ire.org/events-and-training/event/2702/3053/
Welcome reception,Reception,"Kick off the conference with a welcome reception on Thursday night beginning at 6 p.m. Meet up with friends you have not seen since last year and welcome new attendees. Each attendee will receive one drink ticket for beer, wine, soda or bottled water.",TBA,2017-03-02,18:00,19:00,1.0,River Terrace 1,2702/2995,https://ire.org/events-and-training/event/2702/2995/
Conference registration (Friday),Special Event,Registration will be located on the 3rd floor Skybridge of the Hyatt Regency Jacksonville Riverfront.,TBA,2017-03-03,08:00,17:00,9.0,3rd floor - Skybridge,2702/3001,https://ire.org/events-and-training/event/2702/3001/
Conference sales (Friday),Special Event,,TBA,2017-03-03,08:00,17:00,9.0,3rd floor - Skybridge,2702/3005,https://ire.org/events-and-training/event/2702/3005/
Visualization and analysis in Python,Hands-on,,"Nathaniel Lash, Adam Playford",2017-03-03,09:00,10:00,1.0,City Terrace 4,2702/2947,https://ire.org/events-and-training/event/2702/2947/
First Python Notebook: Rapid data analysis in the newsroom (beginner/intermediate) *pre-registered attendees only,Hands-on,"Ben Welsh, James Gordon and Cheryl Phillips teach you how to conduct and publish a data analysis with the Python programming language, its pandas toolkit and a Jupyter Notebook.

The 6-hour, hands-on tutorial will guide you through an investigation of money in politics using data from the California Civic Data Coalition. You will learn just enough Python to do damage with the powerful pandas data analysis library, the most popular open-source library for working with large data files. You will also learn how to record, remix and republish your analysis using the Jupyter Notebook, a browser-based tool for writing code that is emerging as the standard for sharing reproducible research in the sciences. And most importantly, you will see how tools can increase the speed and veracity of your journalism.

Preregistration is required and seating is limited. Laptops will be provided for the training.

Workshop prerequisites: If you've tried Python once or twice, have good attitude and know how to take a few code crashes in stride, you are qualified for this class.

NOTE: Registration is required for this session. Click here to sign up.","James Gordon, Cheryl Phillips, Ben Welsh",2017-03-03,09:00,16:30,7.5,City Terrace 6,2702/2879,https://ire.org/events-and-training/event/2702/2879/
How to use polls and rankings – and how to tell the good from bad,Panel,"Quick survey: how many of you are inundated with press releases about polls, rankings, and best-of lists? You know your readers love that kind of thing, but you don’t want to mislead them with bad data or overstating the results. Maybe the election has you questioning its value in general. We’ll give you the tools you need to quickly sort out what’s worth covering. But let’s go further: You’ll see some real-life examples of even more interesting ways to incorporate this data into your story-telling and reporting.","Matt Carmichael, Chris Jackson, Peter Gade",2017-03-03,09:00,10:00,1.0,River Terrace 1,2702/3047,https://ire.org/events-and-training/event/2702/3047/
Excel Magic (beginner/intermediate) *pre-registered attendees only,Hands-on,"If you've found yourself struggling in a spreadsheet, thinking that whatever you were trying to achieve seemed harder than it should've been, then this is the class for you. You'll learn how to do things with spreadsheets that you never thought possible, such as joining tables and re-arranging badly structured data. You'll learn about the never-ending and amazing power of logical functions, as well as a whole bunch of other functions you probably didn't know about (but should). You'll also learn some handy tools for dealing with dates, times and strings of text that aren't quite the way you'd like them. Plus we'll throw in some other tricks that just make working in spreadsheets a bit easier and more efficient.

Preregistration is required and seating is limited. Laptops will be provided for the training.

Workshop prerequisites: You should have prior experience using Excel or Google Sheets, and be comfortable with introductory-level spreadsheet skills, such as sorting, filtering, SUM and AVERAGE functions, calculations such as percentage change or percent of total, and how to use Pivot Tables.

NOTE: Registration is required for this session. Click here to sign up.",MaryJo Webster,2017-03-03,09:00,12:30,3.5,City Terrace 5,2702/2881,https://ire.org/events-and-training/event/2702/2881/
The lone trainer: Ideas for boosting data literacy in your newsroom,Panel,,"Jennifer LaFleur, Ronald Campbell",2017-03-03,09:00,10:00,1.0,Conference Center B,2702/2907,https://ire.org/events-and-training/event/2702/2907/
How to find stories in data: Data exploration and storytelling,Hands-on,,Heather Krause,2017-03-03,09:00,10:00,1.0,City Terrace 9,2702/2942,https://ire.org/events-and-training/event/2702/2942/
Intro to R: Stepping up your analysis game (beginner),Hands-on,,Charles Minshew,2017-03-03,09:00,10:00,1.0,City Terrace 10,2702/2943,https://ire.org/events-and-training/event/2702/2943/
"The perils, pitfalls and payoffs of working with higher ed data (Sponsored by Lumina Foundation)",Panel,,TBA,2017-03-03,09:00,10:00,1.0,River Terrace 3,2702/3041,https://ire.org/events-and-training/event/2702/3041/
Data crunching in Python (for people who only know Excel),Hands-on,,Cody Winchester,2017-03-03,09:00,10:00,1.0,City Terrace 8,2702/3099,https://ire.org/events-and-training/event/2702/3099/
Uncovering the influence,Panel,,TBA,2017-03-03,09:00,10:00,1.0,Conference Center A,2702/3113,https://ire.org/events-and-training/event/2702/3113/
Conversations 5 (Sponsored by SRCCON - Knight Mozilla OpenNews),Special Event,,TBA,2017-03-03,09:00,10:00,1.0,City Terrace 12,2702/2978,https://ire.org/events-and-training/event/2702/2978/
"When Excel is not enough, you SQL",Hands-on,,Crina Boros,2017-03-03,09:00,12:30,3.5,City Terrace 11,2702/2991,https://ire.org/events-and-training/event/2702/2991/
Kiss your apps goodbye: Saving born-digital news,Demo,,Edward McCain,2017-03-03,09:30,10:00,0.5,River Terrace 2,2702/2908,https://ire.org/events-and-training/event/2702/2908/
Finding narratives in the numbers,Panel,,TBA,2017-03-03,10:15,11:15,1.0,Conference Center B,2702/3114,https://ire.org/events-and-training/event/2702/3114/
Common foundations for newsroom tools,Panel,,TBA,2017-03-03,10:15,11:15,1.0,River Terrace 1,2702/2909,https://ire.org/events-and-training/event/2702/2909/
Gifs for data viz,Demo,,Lena Groeger,2017-03-03,10:15,11:15,1.0,River Terrace 2,2702/2910,https://ire.org/events-and-training/event/2702/2910/
Designing database applications for community engagement (Hosted by Caspio),Hands-on,"Investigative journalists have great ideas, and many are seeking fast, innovative solutions that allow them to publish interactive data applications by deadline. Caspio has the tools to allow you to do this, without the help of a staff developer.

With a little bit of training, you can learn how to develop your own data-driven apps, interactives, consumer investigative sites, and community engagement tools using Caspio.

This demo will showcase real-world examples and techniques for building revenue-generating database applications. Creative community engagement has never been easier.

Note: Pre-registration is not required.","Jennifer Christos, Sabina Tuladhar",2017-03-03,10:15,11:15,1.0,City Terrace 4,2702/2944,https://ire.org/events-and-training/event/2702/2944/
Conversations 6 (Sponsored by SRCCON - Knight Mozilla OpenNews),Special Event,,TBA,2017-03-03,10:15,11:15,1.0,City Terrace 12,2702/2979,https://ire.org/events-and-training/event/2702/2979/
Github for journos (repeat session),Hands-on,,Hector Alfaro,2017-03-03,10:15,11:15,1.0,City Terrace 9,2702/3074,https://ire.org/events-and-training/event/2702/3074/
Phil Meyer Award winners deep dives,Panel,"**Moderated by Jodi Upton, Syracuse University","Jeff Ernsthausen, Scott Pham, Eric Sagara, John Templon, Jodi Upton",2017-03-03,10:15,11:15,1.0,River Terrace 3,2702/3042,https://ire.org/events-and-training/event/2702/3042/
Brain flipping: Tips for switching between the sides of your brain,Panel,,TBA,2017-03-03,10:15,11:15,1.0,Conference Center A,2702/3036,https://ire.org/events-and-training/event/2702/3036/
Data analysis in R (beginner),Hands-on,"Learn how to sort, filter, join and carry out some other basic functions in R to identify trends in your data for storytelling.",Peter Aldhous,2017-03-03,10:15,11:15,1.0,City Terrace 10,2702/2946,https://ire.org/events-and-training/event/2702/2946/
Show me the money: Finding compensation gold in proxy statements,Hands-on,,Jeff Ostrowski,2017-03-03,10:15,11:15,1.0,City Terrace 8,2702/2945,https://ire.org/events-and-training/event/2702/2945/
Google trends,Hands-on,,Jennifer Lee,2017-03-03,11:30,12:30,1.0,City Terrace 4,2702/2972,https://ire.org/events-and-training/event/2702/2972/
Data analysis in Tableau,Hands-on,,Sarah Ryley,2017-03-03,11:30,12:30,1.0,City Terrace 9,2702/3075,https://ire.org/events-and-training/event/2702/3075/
Conversations 7 (Sponsored by SRCCON - Knight Mozilla OpenNews),Special Event,,TBA,2017-03-03,11:30,12:30,1.0,City Terrace 12,2702/2980,https://ire.org/events-and-training/event/2702/2980/
Broadcast: Transforming data into knockout visuals,Panel,,TBA,2017-03-03,11:30,12:30,1.0,River Terrace 1,2702/3012,https://ire.org/events-and-training/event/2702/3012/
Data wrangling with Python,Hands-on,,Anthony DeBarros,2017-03-03,11:30,12:30,1.0,City Terrace 8,2702/2948,https://ire.org/events-and-training/event/2702/2948/
Doing data journalism under duress,Panel,,TBA,2017-03-03,11:30,12:30,1.0,Conference Center B,2702/3038,https://ire.org/events-and-training/event/2702/3038/
Visualizing and understanding uncertainty (Sponsored by Society for News Design),Panel,,"Alberto Cairo, Jen Christiansen, Mark Hansen",2017-03-03,11:30,12:30,1.0,Conference Center A,2702/3091,https://ire.org/events-and-training/event/2702/3091/
Gathering and cleaning data with R (intermediate),Hands-on,Learn how to use R to scrape data from the web and pull data from APIs. This session will also look at how to clean and structure the data you've gathered in preparation for your analysis using tidyverse packages.,Caelainn Barr,2017-03-03,11:30,12:30,1.0,City Terrace 10,2702/2949,https://ire.org/events-and-training/event/2702/2949/
GIS with Python: 6 libraries to know,Demo,,Roberto Rocha,2017-03-03,11:30,12:30,1.0,River Terrace 2,2702/2912,https://ire.org/events-and-training/event/2702/2912/
Jobs and career straight-talk: For (and by) young'uns only,Panel,,"Madi Alexander, Rachel Schallom",2017-03-03,11:30,13:30,2.0,River Terrace 3,2702/2911,https://ire.org/events-and-training/event/2702/2911/
Lunch on your own (Friday),Outside Event,,TBA,2017-03-03,12:30,14:15,1.75,See printed schedule for room information,2702/2997,https://ire.org/events-and-training/event/2702/2997/
Conversations 8 (Sponsored by SRCCON - Knight Mozilla OpenNews),Special Event,,TBA,2017-03-03,12:45,13:45,1.0,City Terrace 12,2702/2981,https://ire.org/events-and-training/event/2702/2981/
Exploring environmental data,Panel,,TBA,2017-03-03,14:15,15:15,1.0,River Terrace 1,2702/2919,https://ire.org/events-and-training/event/2702/2919/
Watch the web for news tips with Klaxon,Special Event,,Tom Meagher,2017-03-03,14:15,15:15,1.0,City Terrace 12,2702/2982,https://ire.org/events-and-training/event/2702/2982/
QGIS I: Importing and displaying geographic data,Hands-on,,"John Walton, Christine Jeavans",2017-03-03,14:15,15:15,1.0,City Terrace 5,2702/2959,https://ire.org/events-and-training/event/2702/2959/
Advanced PDF manipulation,Hands-on,,Miguel Barbosa,2017-03-03,14:15,15:15,1.0,City Terrace 7,2702/2950,https://ire.org/events-and-training/event/2702/2950/
Scraping data without coding (repeat session),Hands-on,"Scraping is a ​technical word for a traditional idea: getting ahold of information, whether or not your sources want you to. In this case, the information is data and the sources are websites. We'll go over some out-of-the-box tools for scraping data, plus some DIY techniques that often work even better.",Sydney Lupkin,2017-03-03,14:15,15:15,1.0,City Terrace 9,2702/2967,https://ire.org/events-and-training/event/2702/2967/
What's the impact?,Panel,"**Moderated by James Hamilton, Stanford University

Investigative stories can change lives and laws, draw audiences, and generate new leads and partnerships. How can you put numbers on these impacts? This panel will try, through discussion of evidence from readership metrics, benefit-cost analyses, survey data, and case studies.","Lindsay Green-Barber, Celeste LeCompte, Tom Rosenstiel, James Hamilton",2017-03-03,14:15,15:15,1.0,Conference Center B,2702/2913,https://ire.org/events-and-training/event/2702/2913/
Unsung data,Panel,,TBA,2017-03-03,14:15,15:15,1.0,River Terrace 3,2702/3057,https://ire.org/events-and-training/event/2702/3057/
Digging into data for stories: A crash course (beginner) *pre-registered attendees only,Hands-on,"Kickstart your data skills with IRE's original mini-boot camp. This series of hands-on classes will introduce you to spreadsheets and databases with IRE's proven techniques. IRE's experienced trainers will walk you through sorting, calculating and interviewing data. You'll come away with a solid base for using data analysis in your own newsroom. In addition, we'll provide you with our boot camp materials to help keep you on track long after you leave the conference.

Preregistration is required and seating is limited. Laptops will be provided for the training.

Workshop prerequisites: There are no prerequisites for this workshop and beginners are welcome. This workshop is good for those wanting to get started analyzing data for stories

Workshop times are Friday, March 3, 2:15pm - 4:30pm; Saturday, March 4, 2:15pm - 5:45pm; Sunday, March 5, 9:00am - 12:30pm (Note: Registration for this session reserves your seat for all days of this workshop and attendees are expected to attend all sessions to complete the workshop.)

**Speakers are IRE/NICAR Staff

NOTE: Registration is required for this session. Click here to sign up.",TBA,2017-03-03,14:15,12:30,-1.75,City Terrace 10/11,2702/2882,https://ire.org/events-and-training/event/2702/2882/
Basic D3 (repeat session),Hands-on,,"Chris Canipe, Jon McClure",2017-03-03,14:15,15:15,1.0,City Terrace 8,2702/3076,https://ire.org/events-and-training/event/2702/3076/
Co-op models in data journalism,Special Event,,Forest Gregg,2017-03-03,15:30,16:30,1.0,City Terrace 12,2702/2983,https://ire.org/events-and-training/event/2702/2983/
Data journalism from space,Demo,"For decades, time-sensitive satellite imagery has been expensive and accessible mostly to governments and large corporations. Recent advances in consumer technologies are making satellite technology cheaper, and new business models are making the production of space-bound hardware and imagery more democratized. Planet Labs, a startup founded by ex-NASA engineers, has the largest constellation of Earth-imaging satellites ever and aims to image the entire planet every day to track global events and challenges like climate change, deforestation, refugee camp growth, disaster response, and many others. The high frequency of Planet's imagery creates new opportunities to capture insight on significant local and global change and is able to move at the rapid rate of today’s 24-hour news cycle. Recent stories include coverage of deforestation in Bolivia, illegal gold mining in Peru, a collapsing glacier, and discovery of North Korean missile tests. As a unique source of data, Planet's imagery is available to approved journalists and socially-impactful projects.",Sara Schnadt,2017-03-03,15:30,16:30,1.0,River Terrace 2,2702/2915,https://ire.org/events-and-training/event/2702/2915/
Intermediate D3 (repeat session),Hands-on,,"Chris Canipe, Jon McClure",2017-03-03,15:30,16:30,1.0,City Terrace 8,2702/3077,https://ire.org/events-and-training/event/2702/3077/
Reproducibility and Rmarkdown: How to use R regularly in your newsroom (intermediate),Hands-on,Learn how to turn your most commonly created custom lines of R code into a function and package for future use. Communicate your findings to others in the newsroom easily with R Markdown. Share all to your Github repo through RStudio for others to download and use or update.,Andrew Tran,2017-03-03,15:30,16:30,1.0,City Terrace 9,2702/3078,https://ire.org/events-and-training/event/2702/3078/
The present and future of bots,Panel,"**Moderated by Tiff Fehr, The New York Times","John Keefe, Simon Rogers, Ken Schwencke, Tiff Fehr",2017-03-03,15:30,16:30,1.0,River Terrace 1,2702/3014,https://ire.org/events-and-training/event/2702/3014/
Intro to Javascript,Hands-on,"Functions, for loops and objects. They can be confusing at first but once you master these and other Javascript coding conventions, you'll be able to build fancy data visualizations and more. In this course, we will be learning the basics of Javascript. No coding experience is necessary.",Chris Essig,2017-03-03,15:30,16:30,1.0,City Terrace 7,2702/2951,https://ire.org/events-and-training/event/2702/2951/
"QGIS II: Manipulating, editing and analyzing geographic data",Hands-on,,Alexandra Kanik,2017-03-03,15:30,16:30,1.0,City Terrace 5,2702/2962,https://ire.org/events-and-training/event/2702/2962/
Quick-turn data stories,Panel,Speaker:,,2017-03-03,15:30,16:30,1.0,River Terrace 3,2702/3043,https://ire.org/events-and-training/event/2702/3043/
Data & abuse of power,Panel,,"Anna Flagg, Moiz Syed",2017-03-03,15:30,16:30,1.0,Conference Center B,2702/2914,https://ire.org/events-and-training/event/2702/2914/
Lightning Talks (Sponsored by the Knight Foundation),Panel,"**Moderated by Sisi Wei, ProPublica

Sometimes you don't need 45 minutes to explain a useful technique or interesting resource. Join your colleagues for a session of short (5-minute) talks about doing CAR, Web development or other related topics.",TBA,2017-03-03,16:45,18:00,1.25,Conference Center A&B,2702/2992,https://ire.org/events-and-training/event/2702/2992/
Philip Meyer Award Presentation,Special Event,"The presentation of the 2016 Philip Meyer Journalism Awards will take place on Friday at the 2017 CAR Conference in Jacksonville. The awards recognize the best uses of social research methods in journalism and are named in honor of Philip Meyer, author of “Precision Journalism” and retired Knight Chair in Journalism and UNC School of Journalism and Mass Communications.

Three awards are given annually — a first, second and third place — to recognize the best work using techniques that are part of precision journalism, computer-assisted reporting and social science research. The awards are: $500 for first, $300 for second, and $200 for third.

For information on the 2016 Award winners, click here.",TBA,2017-03-03,18:00,18:15,0.25,Conference Center A&B,2702/2993,https://ire.org/events-and-training/event/2702/2993/
Philip Meyer Award Reception & David Donald Remembrance,Reception,"Join fellow CAR attendees in celebrating the Philip Meyer Award Winners at a reception Friday night with light hor d'oeuvres and a cash bar beginning at 6:15 p.m. in River Terrace 1.

Join us for a brief tribute to former IRE training director and Philip Meyer Award winner David Donald, who died in December.",TBA,2017-03-03,18:15,19:30,1.25,River Terrace 1,2702/2994,https://ire.org/events-and-training/event/2702/2994/
Conference sales (Saturday),Special Event,,TBA,2017-03-04,08:30,18:00,9.5,3rd floor - Skybridge,2702/3006,https://ire.org/events-and-training/event/2702/3006/
Conference registration (Saturday),Special Event,Registration will be located on the 3rd floor Skybridge of the Hyatt Regency Jacksonville Riverfront.,TBA,2017-03-04,08:30,18:00,9.5,3rd floor - Skybridge,2702/3002,https://ire.org/events-and-training/event/2702/3002/
Advanced analysis in SQL,Hands-on,,Meghan Hoyer,2017-03-04,09:00,10:00,1.0,City Terrace 10,2702/2956,https://ire.org/events-and-training/event/2702/2956/
Drawing for a better brain,Demo,,TBA,2017-03-04,09:00,10:00,1.0,River Terrace 2,2702/3115,https://ire.org/events-and-training/event/2702/3115/
Simple ways to create immersive news stories,Panel,,TBA,2017-03-04,09:00,10:00,1.0,Conference Center A,2702/3008,https://ire.org/events-and-training/event/2702/3008/
Under pressure: Real life in real time with breaking news,Hands-on,,"Noah Pransky, Nicole Vap",2017-03-04,09:00,10:00,1.0,City Terrace 4,2702/3068,https://ire.org/events-and-training/event/2702/3068/
Securing data and communications,Panel,,Jorge Luis Sierra,2017-03-04,09:00,11:15,2.25,River Terrace 1,2702/2917,https://ire.org/events-and-training/event/2702/2917/
Breaking through the Facebook wall: Reporting on Facebook using components of Facebook,Panel,,"Julia Angwin, Jon Keegan, Jeremy Merrill",2017-03-04,09:00,10:00,1.0,Conference Center B,2702/2916,https://ire.org/events-and-training/event/2702/2916/
Geocoding addresses,Hands-on,,Michael Corey,2017-03-04,09:00,10:00,1.0,City Terrace 8,2702/3079,https://ire.org/events-and-training/event/2702/3079/
Build your first news app (intermediate) *pre-registered attendees only,Hands-on,"This mini-boot camp will walk you through the process of building a simple online news application from a dataset. You will get hands-on experience in every stage of the development process, writing Python, HTML and JavaScript using version control tools. You won't stop until you've deployed a working application onto the World Wide Web.

Preregistration is required and seating is limited. Laptops will be provided for the training.

Workshop prerequisites: If you have a good attitude and know how to take a few code crashes in stride, you are qualified for this class.

NOTE: Registration is required for this session. Click here to sign up.","Armand Emamdjomeh, Ben Welsh",2017-03-04,09:00,17:45,8.75,City Terrace 6,2702/2885,https://ire.org/events-and-training/event/2702/2885/
Intro to R (intermediate) *pre-registered attendees only,Hands-on,"Add statistical heft to your reporting by using R, a free, powerful open-source programming language. By the end of this two-hour session, you will be able to take raw data, import it into R, and start your analysis. Topics will include basic data importing, working with directories, reading in data, installing packages, creating simple visualizations, and how to clean, explore and sort your data. We'll also talk about how to find help when you're stuck.

Preregistration is required and seating is limited. Laptops will be provided for the training.

Workshop prerequisites: This session will be most helpful if you’re comfortable working with data and you’re ready to take your skills to the next level.

NOTE: Registration is required for this session. Click here to sign up.",Charles Minshew,2017-03-04,09:00,12:30,3.5,City Terrace 5,2702/2886,https://ire.org/events-and-training/event/2702/2886/
Intro to database manager MySQL I,Hands-on,,Ronald Campbell,2017-03-04,09:00,10:00,1.0,City Terrace 11,2702/2957,https://ire.org/events-and-training/event/2702/2957/
Extracting data from PDFs (repeat session),Hands-on,,Miguel Barbosa,2017-03-04,09:00,10:00,1.0,City Terrace 7,2702/2954,https://ire.org/events-and-training/event/2702/2954/
Stats: An introduction,Hands-on,,Holly Hacker,2017-03-04,09:00,10:00,1.0,City Terrace 9,2702/2955,https://ire.org/events-and-training/event/2702/2955/
Conversations 9 (Sponsored by SRCCON - Knight Mozilla OpenNews),Special Event,,TBA,2017-03-04,09:00,10:00,1.0,City Terrace 12,2702/2984,https://ire.org/events-and-training/event/2702/2984/
Conversations 10 (Sponsored by SRCCON - Knight Mozilla OpenNews),Special Event,,TBA,2017-03-04,10:15,11:15,1.0,City Terrace 12,2702/2985,https://ire.org/events-and-training/event/2702/2985/
Drones for mapping,Demo,,Matt Waite,2017-03-04,10:15,11:15,1.0,River Terrace 2,2702/3023,https://ire.org/events-and-training/event/2702/3023/
Data cleaning in SQL,Hands-on,,Madi Alexander,2017-03-04,10:15,11:15,1.0,City Terrace 10,2702/3082,https://ire.org/events-and-training/event/2702/3082/
Behind the scenes: Electionland,Panel,,"John Keefe, Scott Klein, Olivia Ma",2017-03-04,10:15,11:15,1.0,Conference Center A,2702/2918,https://ire.org/events-and-training/event/2702/2918/
Intro to database manager MySQL II,Hands-on,,Liz Lucas,2017-03-04,10:15,11:15,1.0,City Terrace 11,2702/2961,https://ire.org/events-and-training/event/2702/2961/
Advanced pdf manipulation (repeat session),Hands-on,,Jacob Fenton,2017-03-04,10:15,11:15,1.0,City Terrace 8,2702/3080,https://ire.org/events-and-training/event/2702/3080/
The art and science of the data story comment request,Panel,,"Rob Barry, Cezary Podkul, Sarah Ryley",2017-03-04,10:15,11:15,1.0,River Terrace 3,2702/3010,https://ire.org/events-and-training/event/2702/3010/
